{
  "$schema": "https://json-schema.org/draft/2020-12/schema",
  "$id": "https://archastro.github.io/quint-refinements/artifact.schema.json",
  "title": "Quint refinement artifact",
  "type": "object",
  "additionalProperties": false,
  "required": ["schemaVersion", "modelDigest", "vocabulary", "fixtures", "scenarios"],
  "properties": {
    "schemaVersion": { "enum": [2, 3] },
    "modelDigest": { "type": "string", "pattern": "^sha256:[0-9a-f]{64}$" },
    "vocabulary": { "$ref": "#/$defs/vocabulary" },
    "fixtures": {
      "type": "object",
      "additionalProperties": {
        "type": "object",
        "additionalProperties": true
      }
    },
    "assertionLists": {
      "description": "Schema v3: each distinct list of obligations, once, in order of first appearance. A step names its guards and next lists by index (`guardList`, `nextList`).",
      "type": "array",
      "items": {
        "type": "array",
        "items": { "$ref": "#/$defs/assertion" }
      }
    },
    "scenarios": {
      "type": "array",
      "items": { "$ref": "#/$defs/scenario" }
    }
  },
  "if": {
    "type": "object",
    "properties": { "schemaVersion": { "const": 3 } },
    "required": ["schemaVersion"]
  },
  "then": {
    "required": ["assertionLists"],
    "properties": { "scenarios": { "type": "array", "items": { "$ref": "#/$defs/scenarioWithoutInlineLists" } } }
  },
  "else": {
    "not": { "type": "object", "required": ["assertionLists"] },
    "properties": { "scenarios": { "type": "array", "items": { "$ref": "#/$defs/scenarioWithoutIndexedLists" } } }
  },
  "$defs": {
    "scenarioWithoutInlineLists": {
      "type": "object",
      "properties": {
        "steps": {
          "type": "array",
          "items": { "not": { "type": "object", "anyOf": [{ "required": ["guards"] }, { "required": ["next"] }] } }
        }
      }
    },
    "scenarioWithoutIndexedLists": {
      "type": "object",
      "properties": {
        "steps": {
          "type": "array",
          "items": { "not": { "type": "object", "anyOf": [{ "required": ["guardList"] }, { "required": ["nextList"] }] } }
        }
      }
    },
    "strings": {
      "type": "array",
      "items": { "type": "string" }
    },
    "vocabulary": {
      "type": "object",
      "additionalProperties": false,
      "required": [
        "actions",
        "capabilities",
        "expressionOperators",
        "expressionNames",
        "refinementExpressionOperators",
        "runtimeObservationDependencies",
        "runtimeObservationDependencyDigest"
      ],
      "properties": {
        "actions": { "$ref": "#/$defs/strings" },
        "capabilities": { "$ref": "#/$defs/strings" },
        "expressionOperators": { "$ref": "#/$defs/strings" },
        "expressionNames": { "$ref": "#/$defs/strings" },
        "refinementExpressionOperators": { "$ref": "#/$defs/strings" },
        "runtimeObservationDependencies": { "$ref": "#/$defs/strings" },
        "runtimeObservationDependencyDigest": {
          "type": "string",
          "pattern": "^sha256:[0-9a-f]{64}$"
        }
      }
    },
    "expression": {
      "oneOf": [
        {
          "type": "object",
          "additionalProperties": false,
          "required": ["kind", "value"],
          "properties": {
            "kind": { "enum": ["name", "str"] },
            "value": { "type": "string" }
          }
        },
        {
          "type": "object",
          "additionalProperties": false,
          "required": ["kind", "value"],
          "properties": {
            "kind": { "const": "int" },
            "value": { "type": "integer" }
          }
        },
        {
          "type": "object",
          "additionalProperties": false,
          "required": ["kind", "value"],
          "properties": {
            "kind": { "const": "bool" },
            "value": { "type": "boolean" }
          }
        },
        {
          "type": "object",
          "additionalProperties": false,
          "required": ["kind", "operator", "arguments"],
          "properties": {
            "kind": { "const": "call" },
            "operator": { "type": "string" },
            "arguments": {
              "type": "array",
              "items": { "$ref": "#/$defs/expression" }
            }
          }
        },
        {
          "type": "object",
          "additionalProperties": false,
          "required": ["kind", "parameters", "body"],
          "properties": {
            "kind": { "const": "lambda" },
            "parameters": { "$ref": "#/$defs/strings" },
            "body": { "$ref": "#/$defs/expression" }
          }
        },
        {
          "type": "object",
          "additionalProperties": false,
          "required": ["kind", "value", "body"],
          "properties": {
            "kind": { "const": "let" },
            "name": { "type": "string" },
            "value": { "$ref": "#/$defs/expression" },
            "body": { "$ref": "#/$defs/expression" }
          }
        }
      ]
    },
    "assertion": {
      "type": "object",
      "additionalProperties": false,
      "required": ["scope", "expression"],
      "properties": {
        "scope": { "enum": ["model", "runtime"] },
        "expression": { "$ref": "#/$defs/expression" },
        "dependencies": { "$ref": "#/$defs/strings" }
      }
    },
    "step": {
      "type": "object",
      "required": ["index", "kind"],
      "properties": {
        "index": { "type": "integer", "minimum": 0 },
        "kind": { "enum": ["init", "action", "observe"] },
        "action": { "type": "string" },
        "arguments": {
          "type": "array",
          "items": { "$ref": "#/$defs/expression" }
        },
        "guards": {
          "type": "array",
          "items": { "$ref": "#/$defs/assertion" }
        },
        "next": {
          "type": "array",
          "items": { "$ref": "#/$defs/assertion" }
        },
        "guardList": { "type": "integer", "minimum": 0 },
        "nextList": { "type": "integer", "minimum": 0 },
        "assertions": {
          "type": "array",
          "items": { "$ref": "#/$defs/assertion" }
        }
      }
    },
    "scenario": {
      "type": "object",
      "additionalProperties": false,
      "required": [
        "source",
        "module",
        "fixtureNamespace",
        "name",
        "requiredCapabilities",
        "steps"
      ],
      "properties": {
        "source": { "type": "string" },
        "module": { "type": "string" },
        "fixtureNamespace": { "type": "string" },
        "name": { "type": "string" },
        "requiredCapabilities": { "$ref": "#/$defs/strings" },
        "initialState": true,
        "steps": {
          "type": "array",
          "items": { "$ref": "#/$defs/step" }
        }
      }
    }
  }
}
